{
  "schema_version": "1.0",
  "generated_by": {
    "release": "v0.9.1",
    "commit": "5b6bdb3208f6d98f30d52fa4dff7ba9bb6180040",
    "harness": "transcribed: extraction/v0002 + verification/v0004 · reconcile_dedup/v0001 + reconcile_contradiction/v0001 · thresholds v1 · chat answer/v0004 + eval-coverage/v0001",
    "generated_at": "2026-07-15T13:43:16.000Z",
    "backfilled": true
  },
  "configurations": [
    {
      "id": "mistral-default",
      "models": {
        "pipeline": "mistral-small-latest",
        "answer": "mistral-medium-latest",
        "embedding": "mistral-embed"
      },
      "redaction": false,
      "corpus": {
        "golden_cases": 52,
        "reconcile_pairs": 20,
        "chat_cases": 12,
        "per_language": [
          { "language": "en", "golden_cases": 32 },
          { "language": "hr", "golden_cases": 20 }
        ]
      },
      "metrics": {
        "per_language": [
          {
            "language": "en",
            "golden_cases": 32,
            "extraction_precision": 0.854,
            "extraction_recall": 0.909,
            "verification_agreement": 0.935,
            "dedup_accuracy": 1.0,
            "contradiction_recall": 1.0
          },
          {
            "language": "hr",
            "golden_cases": 20,
            "extraction_precision": 0.75,
            "extraction_recall": 0.833,
            "verification_agreement": 0.842,
            "dedup_accuracy": 0.833,
            "contradiction_recall": 1.0
          }
        ],
        "aggregate": {
          "extraction_precision": 0.81,
          "extraction_recall": 0.878,
          "verification_agreement": 0.9,
          "dedup_accuracy": 0.929,
          "contradiction_recall": 1.0
        },
        "chat": { "cases": 12, "passed": 12, "failed": [] }
      }
    }
  ],
  "notes": [
    "Backfilled: transcribed from the live CI gate run on main after the v0.9.1-era reply-intent fix (#79) — the first fully green live-gate run.",
    "Verification agreement dipped vs v0.8.0 (95.5% → 90.0%): the corpus grew from 46 to 52 cases with harder email-sourced Croatian cases (O4); the gate floor (75%) holds with margin.",
    "v0.9.0 has no trust-score file: it shipped before the live gate had an API key on this repository, so no measured run exists for that tag."
  ]
}
